{
  "state_version": "wikidebia-published-state-1.0",
  "debate_id": "les_hommes_doivent_ils_rejoindre_le_combat_feministe",
  "language": "fr",
  "corpus_version": "manifest-559435ed825dd992",
  "publication_date": "2026-10-23T06:58:41Z",
  "source_manifest_sha256": "205d3669144c1ba5bc672e99002f6b1a3da9a4e7e56950381a2df7d7651212aa",
  "plan_sha256": "2e934627a817399ad9ab8887c99df8b915d027e7e130385cc0352c2c2c3d3d67",
  "receipt_path": ".state/receipts/les_hommes_doivent_ils_rejoindre_le_combat_feministe/latest.json",
  "receipt_sha256": "c1b6736a42a8a179a98daeda533a971de916c7794ee25a75c0a2e0708146770d",
  "pages": [
    {
      "page_id": "A0001",
      "page_type": "argument",
      "canonical_title": "Les hommes ne peuvent pas rester indifférents face aux discriminations et aux violences faites aux femmes",
      "content_sha256": "5a5194fab4fd44276960c4428d268f0572b1088f9ca6180cc6a8dbc395224a08",
      "revision_id": 206928,
      "status": "published"
    },
    {
      "page_id": "A0002",
      "page_type": "argument",
      "canonical_title": "Les hommes ont intérêt à en finir avec le sexisme",
      "content_sha256": "6a753685aa7944cc10937c2728ff9c44d5c181a07615caa5b907bdbce3218398",
      "revision_id": 245843,
      "status": "published"
    },
    {
      "page_id": "A0003",
      "page_type": "argument",
      "canonical_title": "Les femmes ont besoin des hommes pour en finir avec le sexisme",
      "content_sha256": "0f5622f6207b61a1087d9156f9a00335bbdeada2a391c11e84fe816b8d8a3c13",
      "revision_id": 245844,
      "status": "published"
    },
    {
      "page_id": "A0004",
      "page_type": "argument",
      "canonical_title": "Bien des hommes ont fait la preuve de leur engagement pour le combat féministe",
      "content_sha256": "9d47ba8e5dfd5bff0ce52f25a12a800ff9eedb1c4c3c445db680b3badfe7b618",
      "revision_id": 245845,
      "status": "published"
    },
    {
      "page_id": "A0005",
      "page_type": "argument",
      "canonical_title": "La société doit en finir avec le sexisme",
      "content_sha256": "3be0c32e369e08884f83b2b52dd89f0efef83e5b257d80a829900ff2c7839880",
      "revision_id": 245821,
      "status": "published"
    },
    {
      "page_id": "A0006",
      "page_type": "argument",
      "canonical_title": "Les hommes sont socialisés pour dominer les femmes",
      "content_sha256": "9f23ed4565a826d24bce3d54ecfb6aefc6059a157d90cd259feb02c52be53b20",
      "revision_id": 245838,
      "status": "published"
    },
    {
      "page_id": "A0007",
      "page_type": "argument",
      "canonical_title": "Les hommes n'ont aucun intérêt à renoncer à leurs privilèges",
      "content_sha256": "31cb3b9669469ff5f5dfc6da785383ea4fbdecbe9b4a79224afe278a8340f13d",
      "revision_id": 245846,
      "status": "published"
    },
    {
      "page_id": "A0008",
      "page_type": "argument",
      "canonical_title": "Les femmes doivent s'organiser en non-mixité",
      "content_sha256": "d6402147a5138b1b728a79a758f4004f450cc65fee21fdcc8658a914792cee3f",
      "revision_id": 245847,
      "status": "published"
    },
    {
      "page_id": "A0009",
      "page_type": "argument",
      "canonical_title": "Une société ne peut pas fonctionner correctement si elle est égalitaire",
      "content_sha256": "d7bbb6c9263b1a7d678627d6b4e381e4f3d313f77c68e4fb8d2365b0aa55cc43",
      "revision_id": 245839,
      "status": "published"
    },
    {
      "page_id": "A0010",
      "page_type": "argument",
      "canonical_title": "Le féminisme est un mouvement politique où les hommes ne sont pas défendus",
      "content_sha256": "351f81d0875513afd98ccc9b528a4c33943e8b586961aa3e14fcb828e4e51d27",
      "revision_id": 245826,
      "status": "published"
    },
    {
      "page_id": "A0011",
      "page_type": "argument",
      "canonical_title": "Le sexisme est omniprésent",
      "content_sha256": "330d52bedeab194963693876edfdcd89c95139b2d42637fe909ea856b1e1ab20",
      "revision_id": 245827,
      "status": "published"
    },
    {
      "page_id": "A0012",
      "page_type": "argument",
      "canonical_title": "Les hommes sont socialisés pour être égoïstes",
      "content_sha256": "a7ba5e2887cfafbaf75613b196564dbd7d441eb878fce8e42a16248299cd998c",
      "revision_id": 245828,
      "status": "published"
    },
    {
      "page_id": "A0013",
      "page_type": "argument",
      "canonical_title": "Les hommes ne peuvent pas ne pas voir les violences et les discriminations sexistes",
      "content_sha256": "96eb94f511e762ea1cc7fb7e6830fc5ea362f5ba3889940ae6540af641f02382",
      "revision_id": 245848,
      "status": "published"
    },
    {
      "page_id": "A0014",
      "page_type": "argument",
      "canonical_title": "Les hommes sont socialisés pour être indifférents à la souffrance",
      "content_sha256": "9cc13cefbd164145c93e5eef1fadcf46fb3943533f463ef21290efca6c3d4e21",
      "revision_id": 245830,
      "status": "published"
    },
    {
      "page_id": "A0015",
      "page_type": "argument",
      "canonical_title": "Les hommes ne peuvent pas rester insensibles au sort réservé à une moitié de l'humanité",
      "content_sha256": "b9acf7ee8d1e57156f10d1f9af768fa526229ba8b5d88fbf8ea1d771eacdb2d9",
      "revision_id": 245831,
      "status": "published"
    },
    {
      "page_id": "A0016",
      "page_type": "argument",
      "canonical_title": "Les hommes sont socialisés pour se sentir supérieurs aux femmes",
      "content_sha256": "f4318d4e363be6e632af21d169accaa5b1d962e0a13b0ed1f78a9f6b9082b631",
      "revision_id": 245832,
      "status": "published"
    },
    {
      "page_id": "A0017",
      "page_type": "argument",
      "canonical_title": "Les hommes sont socialisés pour déshumaniser les femmes",
      "content_sha256": "640553ca4b91c713755c7daa30d9509f61e971856527fb2d4bc23f26aabcfd8e",
      "revision_id": 245849,
      "status": "published"
    },
    {
      "page_id": "A0018",
      "page_type": "argument",
      "canonical_title": "La solidarité masculine est construite sur le dénigrement et l'exclusion des femmes",
      "content_sha256": "f4318d4e363be6e632af21d169accaa5b1d962e0a13b0ed1f78a9f6b9082b631",
      "revision_id": 245834,
      "status": "published"
    },
    {
      "page_id": "A0019",
      "page_type": "argument",
      "canonical_title": "Les hommes ont intérêt à en finir avec le machisme pour assumer leur sensibilité et leurs émotions",
      "content_sha256": "f4587221e76871a335835bfbcd3422309e63ddda61d1f44f15ba3824605455f6",
      "revision_id": 245841,
      "status": "published"
    },
    {
      "page_id": "A0020",
      "page_type": "argument",
      "canonical_title": "Les hommes bénéficient des discriminations envers les femmes",
      "content_sha256": "8c8196ce8e53a8f512f82bbe2d15b4cf5c368052e203ee5b2ec7b438cd0c6158",
      "revision_id": 245842,
      "status": "published"
    },
    {
      "page_id": "A0021",
      "page_type": "argument",
      "canonical_title": "Les hommes ont intérêt à en finir avec le machisme pour se délivrer de l'injonction à la virilité",
      "content_sha256": "cce51875eab77ee0d77cb44b1729d53b4067625335bd6a6115b2ff10691d2640",
      "revision_id": 245850,
      "status": "published"
    },
    {
      "page_id": "A0022",
      "page_type": "argument",
      "canonical_title": "Les hommes ont intérêt à en finir avec le machisme pour sortir des rapports de rivalité entre hommes",
      "content_sha256": "0acc6dc37deeb9c962d9aa4f8e70bb6051097c68fa44422dc8431a29022e1155",
      "revision_id": 245851,
      "status": "published"
    },
    {
      "page_id": "A0023",
      "page_type": "argument",
      "canonical_title": "Les hommes ont intérêt à en finir avec le machisme pour simplifier et libérer les rapports de séduction",
      "content_sha256": "ad7757c1e6eef91e2f309f28ce60bbf53859111b3e6bb0b97e1fa289b976a4ed",
      "revision_id": 245852,
      "status": "published"
    },
    {
      "page_id": "A0024",
      "page_type": "argument",
      "canonical_title": "La masculinité toxique génère des troubles mentaux et des suicides chez les hommes",
      "content_sha256": "f4318d4e363be6e632af21d169accaa5b1d962e0a13b0ed1f78a9f6b9082b631",
      "revision_id": 245922,
      "status": "published"
    },
    {
      "page_id": "A0025",
      "page_type": "argument",
      "canonical_title": "La masculinité toxique est le terreau de l'homophobie",
      "content_sha256": "f4318d4e363be6e632af21d169accaa5b1d962e0a13b0ed1f78a9f6b9082b631",
      "revision_id": 245853,
      "status": "published"
    },
    {
      "page_id": "A0026",
      "page_type": "argument",
      "canonical_title": "Seul un changement de comportement des hommes pourra mettre fin au sexisme",
      "content_sha256": "59d2cb4ec9f6f840c4ac4afe868793780e850a490c22c5e5da65fd93b17c631d",
      "revision_id": 245854,
      "status": "published"
    },
    {
      "page_id": "A0027",
      "page_type": "argument",
      "canonical_title": "Les femmes sont parfaitement capables de mener le combat féministe par elles-mêmes",
      "content_sha256": "1a4961a98bcf3a1c214b58ed1f3abb30824e250849dfeb22e40eae73f5d32831",
      "revision_id": 245855,
      "status": "published"
    },
    {
      "page_id": "A0028",
      "page_type": "argument",
      "canonical_title": "Les hommes peuvent faire reculer les violences sexistes en prenant au sérieux la parole des femmes victimes",
      "content_sha256": "7f506da291a61eed731b6a72d33595449bb7e3d5ff97701ba8d5603277545611",
      "revision_id": 245856,
      "status": "published"
    },
    {
      "page_id": "A0029",
      "page_type": "argument",
      "canonical_title": "Les femmes ont intérêt à mener le combat féministe sans les hommes",
      "content_sha256": "f4318d4e363be6e632af21d169accaa5b1d962e0a13b0ed1f78a9f6b9082b631",
      "revision_id": 245857,
      "status": "published"
    },
    {
      "page_id": "A0030",
      "page_type": "argument",